External Institution,ECSE325,ECSE415,ECSE416,ECSE444,ECSE544,Total Distinct Courses
École Polytechnique Fédérale de Lausanne,,1,1,,1,3
University of New South Wales (UNSW),,1,1,,,2
Tsinghua University,,1,,,,1
Yonsei University,,1,,,,1
University of the Americas Puebla (UDLAP),,1,,,,1
University of Southern Maine,,,,1,,1
University of Queensland (UQ),1,,,,,1
University of Melbourne,1,,,,,1
Charles University in Prague,,1,,,,1
City University of Hong Kong,,2,,,,1
The Hong Kong Polytechnic University,,1,,,,1
The Chinese University of Hong Kong,,1,,,,1
The Australian National University (ANU),,1,,,,1
Technical University of Denmark,,1,,,,1
National University of Singapore,,2,,,,1
Nanyang Technological University,,2,,,,1
The University of Dublin (Trinity College),,1,,,,1
